{
 "_generated_from": {
  "extractor": "codeaster_en.docs.ingest",
  "extractor_version": "1",
  "source_url": "https://code-aster.org/doc/v16/man_u/u4/u4.72.04.pdf",
  "source_sha256": "2c4bfb62e07960e78ff66892736f5847d7d70f460a8485acfe6266a6d44f7eeb",
  "source_bytes": 295996
 },
 "schema_version": 1,
 "doc_id": "U4.72.04",
 "language": "fr",
 "copyright": "EDF R&D",
 "licence": "GFDL (GNU Free Documentation License; see en/docs/_src/README.md)",
 "meta": {
  "date": "03/11/2021",
  "fascicle": "Manuel d'utilisation Fascicule u4.72: Opérations algébriques",
  "licence_notice": "Document diffusé sous licence GNU FDL (http://www.gnu.org/copyleft/fdl.html)",
  "page_count": 24,
  "pages": "24",
  "pdf_keywords": "U4.72.04-D",
  "pdf_title": "Opérateur CREA_CHAMP",
  "responsible": "",
  "revision": "6806a45e7e56",
  "title": "Opérateur CREA_CHAMP",
  "version_label": "default"
 },
 "blocks": [
  {
   "type": "title",
   "text": "Opérateur CREA_CHAMP",
   "page": 1
  },
  {
   "type": "heading",
   "level": 1,
   "number": "1",
   "text": "But",
   "page": 1
  },
  {
   "type": "paragraph",
   "text": "Créer un champ de type cham_no, carte ou cham_elem. On peut créer un champ",
   "page": 1
  },
  {
   "type": "list_item",
   "depth": 0,
   "text": "par affectation de valeurs sur des nœuds ou des mailles,",
   "page": 1
  },
  {
   "type": "list_item",
   "depth": 0,
   "text": "en assemblant (et / ou combinant) des morceaux de champs existants,",
   "page": 1
  },
  {
   "type": "list_item",
   "depth": 0,
   "text": "en évaluant les fonctions d'un champ de fonctions pour en faire un champ de réels,",
   "page": 1
  },
  {
   "type": "list_item",
   "depth": 0,
   "text": "en modifiant la représentation géométrique d'un champ (passage nœuds ⇔ points de Gauss par exemple),",
   "page": 1
  },
  {
   "type": "list_item",
   "depth": 0,
   "text": "en extrayant un champ d'une structure de données de type SD_RESULTAT (evol_ther, evol_noli, mode_meca, ...).",
   "page": 1
  },
  {
   "type": "list_item",
   "depth": 0,
   "text": "à partir des valeurs contenues dans une structure de données de type TABLE,",
   "page": 1
  },
  {
   "type": "list_item",
   "depth": 0,
   "text": "...",
   "page": 1
  },
  {
   "type": "paragraph",
   "text": "On peut aussi se servir de cette commande pour combiner linéairement plusieurs champs, mais on peut faire des combinaisons plus \"compliquées\" : multiplication de champs ...",
   "page": 1
  },
  {
   "type": "paragraph",
   "text": "Produit une structure de données de type cham_no ou carte ou cham_elem",
   "page": 1
  },
  {
   "type": "paragraph",
   "text": "Remarque : La commande n'est pas ré-entrante sauf pour les opérations ASSE et COMB. Dans ce cas, le mot-clé CHAM_GD est obligatoire.",
   "page": 1
  },
  {
   "type": "paragraph",
   "text": "Table des matières",
   "page": 2
  },
  {
   "type": "paragraph",
   "text": "3.2 Opérande OPERATION = /'AFFE' / 'ASSE' / 'EVAL' / 'DISC' / 'EXTR' / 'R2C' / 'C2R' / 'COMB ' . .10",
   "page": 2
  },
  {
   "type": "code",
   "lines": [
    "ch2 [*] = CREA_CHAMP   (",
    "      ◊   CHAM_GD  = ch1  ,                                   [champ]",
    "      ◊   TITRE =  titre  ,                                   [l_Kn]",
    "      ◊   INFO  =  /1  ,                                      [DEFAUT]",
    "                   /2  ,",
    "      ♦   TYPE_CHAM=   /'NOEU_xxx' ,",
    "                       /'CART_xxx' ,",
    "                       /'ELNO_xxx' ,",
    "                       /'ELGA_xxx' ,",
    "                       /'ELEM_xxx' ,",
    "      # Pour imposer la numérotation du champ résultat",
    "      # (uniquement permis pour les cham_no) :",
    "      ◊   /  NUME_DDL = nu,                                   [nume_ddl]",
    "           / CHAM_NO = cnonu ,                                [cham_no]",
    "      # Si la “structure” du champ résultat(cham_elem ou cham_no)",
    "      # exige des valeurs que l'on ne peut pas déterminer :",
    "      ◊   PROL_ZERO=      /  'NON' ,                          [DEFAUT]",
    "                          /  'OUI' ,",
    "      # Si l'on souhaite créer un cham_elem à “sous-points” pour lequel",
    "      # tous les sous-points (d'un même point) ont la même valeur :",
    "      ◊   AFFE_SP= _F  (  ♦  CARA_ELEM     =  carele ,),      [cara_elem]"
   ],
   "page": 4
  },
  {
   "type": "code",
   "lines": [
    "/   OPERATION=             'AFFE' ,",
    "#  ===============================",
    "    ♦  /  MAILLAGE  =         ma ,                      [maillage]",
    "      /  MODELE    =         mo ,                      [modele]",
    "    ♦  AFFE= (_F (  ♦  /   TOUT      =  'OUI' ,",
    "                       /      |  GROUP_MA  =   grma  ,  [l_grma]",
    "                              |  GROUP_NO  =   grno  ,  [l_grno]",
    "                    ♦  NOM_CMP   = lcmp ,               [l_K8]",
    "                    ♦  /   VALE  = lvaler  ,            [l_R]",
    "                       /   VALE_I= lvalei  ,            [l_I]",
    "                       /   VALE_C= lvalec  ,            [l_C]",
    "                       /   VALE_F= lvalef  ,      /     [l_fonction]",
    "                                                  /     [l_formule]",
    "                 ),),",
    "/   OPERATION=             'ASSE' ,",
    "#   ===============================",
    "    ♦  /  MAILLAGE  =         ma ,                      [maillage]",
    "       /  MODELE    =         mo ,                      [modele]",
    "          ◊  OPTION    =      option                    [Kn]",
    "    ♦  ASSE= (_F (  ♦      /  TOUT      =  'OUI' ,",
    "                           /  |  GROUP_MA  =   grma  ,  [l_grma]",
    "                              |  GROUP_NO  =   grno  ,  [l_grno]",
    "                    ♦  CHAM_GD       = ch1 ,            [champ]",
    "                    ◊  NOM_CMP       = lcmp,            [l_K8]",
    "                       ◊   NOM_CMP_RESU = lcmp_resu,    [l_K8]",
    "                    ◊  /   CUMUL =         'NON'  ,     [DEFAUT]",
    "                       /   CUMUL =         'OUI'  ,",
    "                           ◊  /  COEF_R =  /   1. ,     [DEFAUT]",
    "                                           /   coefr ,  [R]",
    "                              /  COEF_C =      coefc ,  [C]",
    "                 ),),",
    "/   OPERATION=             'COMB' ,",
    "#   ===============================",
    "    ♦  COMB= (_F (",
    "          ♦  CHAM_GD       = ch1 ,                   [cham_no]",
    "          ♦  COEF_R        =  coefr  ,               [R]",
    "    ),),",
    "/   OPERATION=             'EVAL' ,",
    "#   ===============================",
    "    ♦  CHAM_F=   ch_fonc   ,            /      [cham_no (NEUT_F)]",
    "                                        /      [cham_elem (NEUT_F)]",
    "    ♦  CHAM_PARA=   l_ch_para ,                [l_champ]",
    "/   OPERATION=             'DISC' ,",
    "#   ===============================",
    "    #  si le champ résultat est un CHAM_ELEM :",
    "    ◊  MODELE    =         mo ,                         [modele]",
    "       ◊  OPTION    = option                            [Kn]",
    "    ♦  CHAM_GD   =     ch1 ,                            [champ]",
    "/   OPERATION=             'NORMALE' ,",
    "#   ===================================",
    "    ♦  MODELE          =         mo ,                   [modele]",
    "    ♦  GROUP_MA        =         l_gma ,                [l_group_ma]",
    "/   OPERATION=             'R2C' ,",
    "#   ===================================",
    "    # pour transformer un champ aux nœuds réel en champ complexe",
    "    # (avec partie imaginaire nulle)",
    "    ♦  CHAM_GD             =         chR ,              [cham_no]",
    "/   OPERATION=             'C2R' ,",
    "#   ===================================",
    "    # pour transformer un champ aux nœuds complexe en champ réel :",
    "    ♦  CHAM_GD      =         chC ,                     [cham_no]",
    "    ♦  PARTIE       =      /  'REEL',   # partie réelle",
    "                           /  'IMAG',   # partie imaginaire",
    "                           /  'MODULE', # valeur absolue",
    "                           /  'PHASE',  # \"phase\" (en degrés)"
   ],
   "page": 4
  },
  {
   "type": "code",
   "lines": [
    "      /   OPERATION=             'EXTR' ,",
    "      #   ===============================",
    "          ♦  #  extraction du champ de géométrie d'un maillage :",
    "             /  ♦  MAILLAGE =    ma ,                         [maillage]",
    "                ♦  NOM_CHAM =    'GEOMETRIE' ,",
    "             #  extraction du champ d'abscisse curviligne d'un maillage :",
    "             /  ♦  MAILLAGE =    ma ,                         [maillage]",
    "                ♦  NOM_CHAM =    'ABSC_CURV' ,",
    "             #  extraction dans une table :",
    "             /  ♦   TABLE    =   tabl  ,                      [table]",
    "                ♦  /   MAILLAGE  =  ma  ,                     [maillage]",
    "                   /   MODELE=   mo  ,                        [modele]",
    "                       ◊  OPTION =  option  ,                 [kn]",
    "             #  extraction des \"level set\" d’une SD fiss_xfem :",
    "             /  ♦  FISSURE = fxfem  ,                         [fiss_xfem]",
    "                ♦  NOM_CHAM =    /  'LTNO' ,",
    "                                 /  'LNNO' ,",
    "                                 /  'GRLTNO' ,",
    "                                 /  'GRLNNO' ,",
    "                                 /  'STNO' ,",
    "                                 /  'STNOR' ,",
    "                                 /  'BASLOC' ,",
    "             #  extraction d'un champ d’une SD cara_elem :",
    "             /  ♦  CARA_ELEM =   carele,                      [cara_elem]",